{
    "schemaVersion": "2",
    "name": "ai-harness",
    "version": "1.3.0",
    "description": "Provider-neutral AI agent harness: bring an API key (Anthropic, OpenAI, OpenRouter or Google), define tasks, and let the agent resolve them.",
    "compatibility": {
        "engines": {
            "node": ">=18.17",
            "typescript": ">=5.0.0"
        },
        "directImport": {
            "peerDependencies": []
        },
        "fullControl": {
            "dependencies": []
        }
    },
    "entryPoint": "index.ts",
    "philosophy": {
        "errorModel": "mixed",
        "observability": [],
        "testStyle": "vitest-no-mocks-in-core",
        "externalDeps": [],
        "testDeps": ["vitest"]
    },
    "docs": {
        "context": "KIT_CONTEXT.md",
        "readme": "README.md"
    },
    "lint": {
        "nodenextImports": "warn",
        "noBareAny": "warn",
        "noExternalImports": "error",
        "noUpwardImports": "error"
    },
    "exports": [
        "createProvider",
        "createAnthropicProvider",
        "createOpenAIProvider",
        "createOpenRouterProvider",
        "createGoogleProvider",
        "ProviderError",
        "runHarness",
        "defaultBuildPrompt",
        "nextRunnableTask",
        "countTasks",
        "DEFAULT_LIMITS",
        "DEFAULT_PROTECTED_PATTERNS"
    ],
    "changelog": [
        "1.1.0 - Add @cullet/ai-harness: a provider-neutral AI agent harness. Ships fetch-based adapters for Anthropic, OpenAI, OpenRouter and Google (no vendor SDK dependency), an importable `runHarness` loop with injectable `apply`/`verify`/`buildPrompt` strategies, and opt-in Node runtime helpers (file writing with guardrails, shell sensors, and a git checkpoint that commits passing tasks and rolls back failed attempts) under the `@cullet/ai-harness/node` subpath. The API key is always passed explicitly and no model id is hard-coded.",
        "1.2.0 - Close the prompt↔writer gap in the Node runtime.",
        "1.3.0 - Add extended thinking (reasoning) support to the provider contract and Anthropic adapter"
    ],
    "deprecated": false
}
