{
    "schemaVersion": "2",
    "name": "erp-core",
    "version": "1.0.6",
    "description": "Núcleo arquitetural para ERP em TypeScript — entidades, value objects, erros tipados e policies declaráveis sobre clean architecture.",
    "compatibility": {
        "engines": {
            "node": ">=18.17",
            "typescript": ">=5.0.0"
        },
        "directImport": {
            "peerDependencies": [
                {
                    "name": "zod",
                    "range": ">=3.22.0 <5"
                }
            ]
        },
        "fullControl": {
            "dependencies": [
                {
                    "name": "zod",
                    "range": ">=3.22.0 <5"
                }
            ]
        }
    },
    "entryPoint": "index.ts",
    "philosophy": {
        "errorModel": "mixed",
        "observability": ["log-port", "metric-port", "trace-port"],
        "testStyle": "vitest-no-mocks-in-core",
        "externalDeps": ["zod"],
        "testDeps": ["vitest"]
    },
    "docs": {
        "context": "KIT_CONTEXT.md",
        "readme": "README.md"
    },
    "lint": {
        "nodenextImports": "warn",
        "noBareAny": "warn",
        "noExternalImports": "error",
        "noUpwardImports": "error",
        "architectureLayers": "error",
        "portsArePure": "error",
        "applicationReturnsResult": "error",
        "requiredCoreTests": "error",
        "noMocksInCoreTests": "error"
    },
    "exports": [
        "Entity",
        "ValueObject",
        "AppError",
        "ValidationError",
        "NotFoundError",
        "ConflictError",
        "AuthorizationError",
        "IntegrationError",
        "PolicyCatalog",
        "PolicyDefinition",
        "PolicyDecision",
        "PolicyResolver",
        "PolicyService",
        "mapPolicyEvaluationError"
    ],
    "changelog": [
        "1.0.0 - Registro inicial do boilerplate com primitives tipadas para import direto, CLI e fluxo full-control.",
        "1.0.1 - Corrige exemplos de consumo no README: import direto usa o nome npm com escopo e o argumento do `cullet fc` é o nome do kit no registry.",
        "1.0.2 - Declara explicitamente os lints de arquitetura em camadas; o catálogo passa a ser neutro de arquitetura.",
        "1.0.3 - Ajuste de descrição do pacote.",
        "1.0.4 - `ConditionEvaluatorV1` rejeita `and` vazio com `EMPTY_AND_CONDITION` em vez de avaliar como `true`.",
        "1.0.5 - Amplia a cobertura de testes internos (mapeamento de erros de policy, catálogos de erro, `AppError.toJSON`, repositório de definitions); sem mudanças de API pública.",
        "1.0.6 - Endurece utilitários recursivos (json-safe, deepFreeze, hashing) contra ciclos e aperta contratos de corretude (semver, `Entity`, condition evaluator)."
    ],
    "deprecated": false
}
