{
    "schemaVersion": "2",
    "name": "erp-core",
    "version": "1.1.0",
    "description": "Núcleo arquitetural para ERP em TypeScript — entidades, value objects, erros tipados e policies declaráveis sobre clean architecture.",
    "compatibility": {
        "engines": {
            "node": ">=18.17",
            "typescript": ">=5.0.0"
        },
        "directImport": {
            "peerDependencies": [
                {
                    "name": "zod",
                    "range": ">=3.22.0 <5",
                    "optional": true,
                    "notes": "Only required by the `./policies` subpath (gate/compute engines). The domain/result/errors/exceptions/rulesets/versioning/plugins subpaths are zod-free."
                }
            ]
        },
        "fullControl": {
            "dependencies": [
                {
                    "name": "zod",
                    "range": ">=3.22.0 <5"
                }
            ]
        }
    },
    "entryPoint": "index.ts",
    "philosophy": {
        "errorModel": "mixed",
        "observability": ["log-port", "metric-port", "trace-port"],
        "testStyle": "vitest-no-mocks-in-core",
        "externalDeps": ["zod"],
        "testDeps": ["vitest"]
    },
    "docs": {
        "context": "KIT_CONTEXT.md",
        "readme": "README.md"
    },
    "lint": {
        "nodenextImports": "warn",
        "noBareAny": "warn",
        "noExternalImports": "error",
        "noUpwardImports": "error",
        "architectureLayers": "error",
        "portsArePure": "error",
        "applicationReturnsResult": "error",
        "requiredCoreTests": "error",
        "noMocksInCoreTests": "error"
    },
    "exports": [
        "Entity",
        "ValueObject",
        "PluginManager",
        "Result",
        "Outcome",
        "RulesetRegistry",
        "DomainException",
        "InvariantViolationException",
        "ValidationException",
        "ValidationField",
        "version",
        "createDomainEventEnvelope",
        "AppError",
        "ValidationError",
        "NotFoundError",
        "ConflictError",
        "AuthorizationError",
        "IntegrationError",
        "PolicyCatalog",
        "PolicyDefinition",
        "PolicyDecision",
        "PolicyResolver",
        "PolicyService",
        "mapPolicyEvaluationError"
    ],
    "changelog": [
        "1.0.1 - Corrige os exemplos de consumo nos READMEs dos kits: o import direto usa o nome npm com escopo (`@cullet/<kit>`) e o argumento do `npx cullet fc` é o nome do kit no registry (`erp-core`), não o nome com escopo. Adiciona a nota explicando o que o `fc` faz no `erp-core`.",
        "1.0.2 - erp-core declara explicitamente os lints de arquitetura em camadas; o catálogo passa a ser neutro de arquitetura.",
        "1.0.3 - Reescreve a descrição do pacote para refletir a entrega dupla do cullet — kits de biblioteca importáveis e kits de tooling copy-first via CLI — e a deixa consistente entre package.json e a saída do `cullet --help`. Só cullet entra (o package.json raiz é private, não publica). O reformat não precisa de changeset: a tarball publicada leva dist/ buildado, cuja saída não muda com a reformatação do src/.",
        "1.0.4 - fix(erp-core): return an error when an AND node has no child conditions",
        "1.0.5 - Expand internal test coverage for previously untested or thinly-tested units: policy error mapping and policy-evaluation error kinds (`INVALID_POLICY_KEY`, `POLICY_DEFINITION_NOT_FOUND`), the conflict/serialization/idempotency error catalogs, `AppError.toJSON`, `RequestedBy`, `PolicyKey`, policy semver comparison, and the in-memory policy definition repository's eligibility filtering. No runtime or public API changes — spec files are excluded from the published package.",
        "1.0.6 - Harden recursive utilities and tighten a few correctness contracts",
        "1.0.7 - Make the kit source nodenext-safe so the full-control copy (`npx cullet fc erp-core`) compiles and runs beyond a bundler.",
        "1.0.8 - Align kit metadata with what the package actually ships and fix doc/packaging gaps. No runtime or public API changes.",
        "1.0.9 - Harden erp-core invariants and error serialization",
        "1.0.10 - Stop the `meta.json` `changelog` from drifting and clarify the `ValueObject` freeze contract.",
        "1.0.11 - Document the public API surface with TSDoc.",
        "1.1.0 - **New: `ResultRepository`, `UseCaseObservability`, and `./application` subpath**"
    ],
    "deprecated": false
}
